2023/08/17 7:38:38 a. m. GMT-6,johan.rosas6621@alumnos.udg.mx,7.00 / 30,Johan Alejandro Rosas Gueta ,-- / 0,,Tercer Semestre,-- / 0,,"Sí, primera vez.",-- / 0,,E,-- / 0,,2023-08-17,-- / 0,,"(D) considerablemente menor para la bola más pesada, pero no necesariamente la mitad.",0.00 / 1,,"(D) la bola más pesada golpea el suelo considerablemente más cerca de la base de la mesa que la bola más liviana, pero no necesariamente a la mitad de la distancia horizontal.",0.00 / 1,,(A) alcanza un máximo de velocidad muy pronto después de ser soltada y desde entonces cae con una velocidad constante.,0.00 / 1,,(E) el camión ejerce una fuerza de la misma intensidad sobre el auto que la que el auto ejerce sobre el camión.,1.00 / 1,,"(D) 1, 2 y 3.",0.00 / 1,,(A),0.00 / 1,,(B),1.00 / 1,,(E),0.00 / 1,,"(D) menor que cualquiera de las velocidades ""v₀"" o ""v₁"".",0.00 / 1,,(C) disminuye continuamente.,0.00 / 1,,"(C) una fuerza hacia abajo debida a la gravedad, una fuerza hacia arriba ejercida por la superficie y una fuerza horizontal en la dirección del movimiento.",0.00 / 1,,(D),0.00 / 1,,(B) una fuerza hacia arriba que disminuye continuamente desde el momento en que la bola abandona la mano del chico hasta que alcanza su punto más alto; en el camino de descenso hay una fuerza hacia abajo debida a la gravedad que aumenta continuamente a medida que el objeto se acerca progresivamente a la tierra.,0.00 / 1,,(A),0.00 / 1,,(C) la intensidad de la fuerza que el automóvil aplica sobre el camión es mayor que la de la fuerza que el camión aplica sobre el auto.,0.00 / 1,,(B) la intensidad de la fuerza que el automóvil aplica sobre el camión es menor que la de la fuerza que el camión aplica sobre el auto.,0.00 / 1,,(A) la fuerza hacia arriba ejercida por el cable es mayor que la fuerza hacia abajo debida a la gravedad.,0.00 / 1,,(B) 1 y 2.,1.00 / 1,,"(E) sí, en algún momento durante el intervalo de 3 a 4.",1.00 / 1,,"(C) la aceleración de ""b"" es mayor que la aceleración de ""a"".",0.00 / 1,,(E),1.00 / 1,,(B) continuamente creciente.,1.00 / 1,,(C),0.00 / 1,,(C) continuamente decreciente.,0.00 / 1,,(B) es mayor que el peso de la caja.,0.00 / 1,,"(D) con una velocidad creciente durante un rato, y después con una velocidad constante.",0.00 / 1,,(A) se parará inmediatamente.,0.00 / 1,,"(D) ambos estudiantes ejercen una fuerza sobre el otro, pero ""a"" ejerce una fuerza mayor.",0.00 / 1,,(A) sólo la 1.,0.00 / 1,,(C) 1 y 3.,1.00 / 1,
2023/08/17 8:27:22 a. m. GMT-6,emanuel.perez0539@alumnos.udg.mx,8.00 / 30,Emanuel Perez Hernandez,-- / 0,,1,-- / 0,,No.,-- / 0,,E,-- / 0,,2023-08-17,-- / 0,,(C) aproximadamente el mismo para ambas bolas.,1.00 / 1,,(B) la bola más pesada golpea el suelo aproximadamente a la mitad de la distancia horizontal de la base de la mesa que la bola más liviana.,0.00 / 1,,(A) alcanza un máximo de velocidad muy pronto después de ser soltada y desde entonces cae con una velocidad constante.,0.00 / 1,,(A) la intensidad de la fuerza que el camión ejerce sobre el automóvil es mayor que la de la fuerza que el auto ejerce sobre el camión.,0.00 / 1,,"(D) 1, 2 y 3.",0.00 / 1,,(A),0.00 / 1,,(B),1.00 / 1,,(B),1.00 / 1,,"(C) igual a la suma aritmética de las velocidades ""v₀"" y ""v₁"".",0.00 / 1,,(D) aumenta durante un rato y después disminuye.,0.00 / 1,,(B) una fuerza hacia abajo debida a la gravedad y una fuerza horizontal en la dirección del movimiento.,0.00 / 1,,(B),1.00 / 1,,(C) una fuerza hacia abajo prácticamente constante debida a la gravedad junto con una fuerza hacia arriba que disminuye continuamente hasta que la bola alcanza su punto más alto; en el camino de descenso sólo hay una fuerza constante hacia abajo debida a la gravedad.,0.00 / 1,,(A),0.00 / 1,,(C) la intensidad de la fuerza que el automóvil aplica sobre el camión es mayor que la de la fuerza que el camión aplica sobre el auto.,0.00 / 1,,(A) la intensidad de la fuerza que el automóvil aplica sobre el camión es igual a la de la fuerza que el camión aplica sobre el auto.,1.00 / 1,,(A) la fuerza hacia arriba ejercida por el cable es mayor que la fuerza hacia abajo debida a la gravedad.,0.00 / 1,,"(E) 1, 3 y 4.",0.00 / 1,,"(C) sí, en el instante 5.",0.00 / 1,,(E) no se da suficiente información para contestar la pregunta.,0.00 / 1,,(A),0.00 / 1,,(D) creciente durante un rato y después constante.,0.00 / 1,,(D),0.00 / 1,,(A) constante.,1.00 / 1,,(E) es mayor que el peso de la caja y también que la fuerza total que se opone a su movimiento.,0.00 / 1,,"(A) con una velocidad constante que es el doble de la velocidad ""v₀"" de la pregunta anterior.",0.00 / 1,,(C) comenzará inmediatamente a frenar hasta pararse.,1.00 / 1,,"(B) el estudiante ""a"" ejerce una fuerza sobre el estudiante ""b"", pero ""b"" no ejerce ninguna fuerza sobre ""a"".",0.00 / 1,,(A) sólo la 1.,0.00 / 1,,(C) 1 y 3.,1.00 / 1,
2023/08/17 10:01:11 a. m. GMT-6,emilio.parra9269@alumnos.udg.mx,10.00 / 30,Emilio Alfredo Parra Escareño ,-- / 0,,1,-- / 0,,No.,-- / 0,,E,-- / 0,,2023-08-16,-- / 0,,"(D) considerablemente menor para la bola más pesada, pero no necesariamente la mitad.",0.00 / 1,,"(D) la bola más pesada golpea el suelo considerablemente más cerca de la base de la mesa que la bola más liviana, pero no necesariamente a la mitad de la distancia horizontal.",0.00 / 1,,(C) aumenta su velocidad porque una fuerza de gravedad casi constante actúa sobre ella.,1.00 / 1,,(A) la intensidad de la fuerza que el camión ejerce sobre el automóvil es mayor que la de la fuerza que el auto ejerce sobre el camión.,0.00 / 1,,(B) 1 y 2.,1.00 / 1,,(B),1.00 / 1,,(B),1.00 / 1,,(D),0.00 / 1,,"(E) mayor que cualquiera de las velocidades ""v₀"" o ""v₁"", pero menor que la suma aritmética de estas dos velocidades.",1.00 / 1,,(D) aumenta durante un rato y después disminuye.,0.00 / 1,,"(C) una fuerza hacia abajo debida a la gravedad, una fuerza hacia arriba ejercida por la superficie y una fuerza horizontal en la dirección del movimiento.",0.00 / 1,,(B),1.00 / 1,,(B) una fuerza hacia arriba que disminuye continuamente desde el momento en que la bola abandona la mano del chico hasta que alcanza su punto más alto; en el camino de descenso hay una fuerza hacia abajo debida a la gravedad que aumenta continuamente a medida que el objeto se acerca progresivamente a la tierra.,0.00 / 1,,(D),1.00 / 1,,(A) la intensidad de la fuerza que el automóvil aplica sobre el camión es igual a la de la fuerza que el camión aplica sobre el auto.,1.00 / 1,,(C) la intensidad de la fuerza que el automóvil aplica sobre el camión es mayor que la de la fuerza que el camión aplica sobre el auto.,0.00 / 1,,(A) la fuerza hacia arriba ejercida por el cable es mayor que la fuerza hacia abajo debida a la gravedad.,0.00 / 1,,(C) 1 y 3.,0.00 / 1,,"(D) sí, en los instantes 2 y 5.",0.00 / 1,,"(C) la aceleración de ""b"" es mayor que la aceleración de ""a"".",0.00 / 1,,(E),1.00 / 1,,(A) constante.,0.00 / 1,,(C),0.00 / 1,,(C) continuamente decreciente.,0.00 / 1,,(B) es mayor que el peso de la caja.,0.00 / 1,,"(A) con una velocidad constante que es el doble de la velocidad ""v₀"" de la pregunta anterior.",0.00 / 1,,(A) se parará inmediatamente.,0.00 / 1,,"(B) el estudiante ""a"" ejerce una fuerza sobre el estudiante ""b"", pero ""b"" no ejerce ninguna fuerza sobre ""a"".",0.00 / 1,,"(D) 1, 2 y 3.",0.00 / 1,,(C) 1 y 3.,1.00 / 1,
2023/08/17 10:32:56 a. m. GMT-6,Itzel.ruiz0392@alumnos.udg.mx,9.00 / 30,Ruiz López Itzel ,-- / 0,,1,-- / 0,,No.,-- / 0,,E,-- / 0,,2023-08-17,-- / 0,,"(D) considerablemente menor para la bola más pesada, pero no necesariamente la mitad.",0.00 / 1,,"(D) la bola más pesada golpea el suelo considerablemente más cerca de la base de la mesa que la bola más liviana, pero no necesariamente a la mitad de la distancia horizontal.",0.00 / 1,,(D) cae debido a la tendencia natural de todos los objetos a descansar sobre la superficie de la tierra.,0.00 / 1,,(A) la intensidad de la fuerza que el camión ejerce sobre el automóvil es mayor que la de la fuerza que el auto ejerce sobre el camión.,0.00 / 1,,(B) 1 y 2.,1.00 / 1,,(B),1.00 / 1,,(B),1.00 / 1,,(B),1.00 / 1,,"(C) igual a la suma aritmética de las velocidades ""v₀"" y ""v₁"".",0.00 / 1,,(C) disminuye continuamente.,0.00 / 1,,(B) una fuerza hacia abajo debida a la gravedad y una fuerza horizontal en la dirección del movimiento.,0.00 / 1,,(B),1.00 / 1,,(C) una fuerza hacia abajo prácticamente constante debida a la gravedad junto con una fuerza hacia arriba que disminuye continuamente hasta que la bola alcanza su punto más alto; en el camino de descenso sólo hay una fuerza constante hacia abajo debida a la gravedad.,0.00 / 1,,(A),0.00 / 1,,(B) la intensidad de la fuerza que el automóvil aplica sobre el camión es menor que la de la fuerza que el camión aplica sobre el auto.,0.00 / 1,,(C) la intensidad de la fuerza que el automóvil aplica sobre el camión es mayor que la de la fuerza que el camión aplica sobre el auto.,0.00 / 1,,(A) la fuerza hacia arriba ejercida por el cable es mayor que la fuerza hacia abajo debida a la gravedad.,0.00 / 1,,(C) 1 y 3.,0.00 / 1,,"(E) sí, en algún momento durante el intervalo de 3 a 4.",1.00 / 1,,"(C) la aceleración de ""b"" es mayor que la aceleración de ""a"".",0.00 / 1,,(A),0.00 / 1,,(B) continuamente creciente.,1.00 / 1,,(B),1.00 / 1,,(C) continuamente decreciente.,0.00 / 1,,(E) es mayor que el peso de la caja y también que la fuerza total que se opone a su movimiento.,0.00 / 1,,"(B) con una velocidad constante que es mayor que la velocidad ""v₀"" de la pregunta anterior, pero no necesariamente el doble.",0.00 / 1,,(C) comenzará inmediatamente a frenar hasta pararse.,1.00 / 1,,"(C) ambos estudiantes ejercen una fuerza sobre el otro, pero ""b"" ejerce una fuerza mayor.",0.00 / 1,,(A) sólo la 1.,0.00 / 1,,"(E) 1, 2 y 3.",0.00 / 1,
2023/08/17 11:48:59 a. m. GMT-6,nancy.hernandez3246@alumnos.udg.mx,8.00 / 30,Nancy Margarita Hernández Valderrábano,-- / 0,,Primero,-- / 0,,No.,-- / 0,,E,-- / 0,,2023-08-17,-- / 0,,(C) aproximadamente el mismo para ambas bolas.,1.00 / 1,,(A) ambas bolas golpean el suelo aproximadamente a la misma distancia horizontal de la base de la mesa.,1.00 / 1,,(C) aumenta su velocidad porque una fuerza de gravedad casi constante actúa sobre ella.,1.00 / 1,,(D) el camión ejerce una fuerza sobre el automóvil pero el auto no ejerce ninguna fuerza sobre el camión.,0.00 / 1,,(C) 1 y 3.,0.00 / 1,,(B),1.00 / 1,,(B),1.00 / 1,,(E),0.00 / 1,,"(C) igual a la suma aritmética de las velocidades ""v₀"" y ""v₁"".",0.00 / 1,,(D) aumenta durante un rato y después disminuye.,0.00 / 1,,(B) una fuerza hacia abajo debida a la gravedad y una fuerza horizontal en la dirección del movimiento.,0.00 / 1,,(B),1.00 / 1,,(C) una fuerza hacia abajo prácticamente constante debida a la gravedad junto con una fuerza hacia arriba que disminuye continuamente hasta que la bola alcanza su punto más alto; en el camino de descenso sólo hay una fuerza constante hacia abajo debida a la gravedad.,0.00 / 1,,(A),0.00 / 1,,"(D) dado que el motor del automóvil está en marcha, éste puede empujar al camión, pero el motor del camión no está funcionando, de modo que el camión no puede empujar al auto. El camión es empujado hacia adelante simplemente porque está en el camino del automóvil.",0.00 / 1,,(B) la intensidad de la fuerza que el automóvil aplica sobre el camión es menor que la de la fuerza que el camión aplica sobre el auto.,0.00 / 1,,(A) la fuerza hacia arriba ejercida por el cable es mayor que la fuerza hacia abajo debida a la gravedad.,0.00 / 1,,"(D) 1, 2 y 3.",0.00 / 1,,"(D) sí, en los instantes 2 y 5.",0.00 / 1,,"(C) la aceleración de ""b"" es mayor que la aceleración de ""a"".",0.00 / 1,,(B),0.00 / 1,,(D) creciente durante un rato y después constante.,0.00 / 1,,(B),1.00 / 1,,(C) continuamente decreciente.,0.00 / 1,,(D) es mayor que la fuerza total que se opone al movimiento de la caja.,0.00 / 1,,"(A) con una velocidad constante que es el doble de la velocidad ""v₀"" de la pregunta anterior.",0.00 / 1,,(C) comenzará inmediatamente a frenar hasta pararse.,1.00 / 1,,"(B) el estudiante ""a"" ejerce una fuerza sobre el estudiante ""b"", pero ""b"" no ejerce ninguna fuerza sobre ""a"".",0.00 / 1,,(A) sólo la 1.,0.00 / 1,,"(E) 1, 2 y 3.",0.00 / 1,
2023/08/17 12:31:58 p. m. GMT-6,diego.quevedo5103@alumnos.udg.mx,10.00 / 30,Diego André Quevedo Salazar,-- / 0,,1,-- / 0,,No.,-- / 0,,E,-- / 0,,2023-08-17,-- / 0,,"(D) considerablemente menor para la bola más pesada, pero no necesariamente la mitad.",0.00 / 1,,"(D) la bola más pesada golpea el suelo considerablemente más cerca de la base de la mesa que la bola más liviana, pero no necesariamente a la mitad de la distancia horizontal.",0.00 / 1,,(B) aumenta su velocidad mientras cae porque la atracción gravitatoria se hace considerablemente mayor cuanto más se acerca la piedra a la tierra.,0.00 / 1,,(A) la intensidad de la fuerza que el camión ejerce sobre el automóvil es mayor que la de la fuerza que el auto ejerce sobre el camión.,0.00 / 1,,(C) 1 y 3.,0.00 / 1,,(B),1.00 / 1,,(B),1.00 / 1,,(B),1.00 / 1,,"(C) igual a la suma aritmética de las velocidades ""v₀"" y ""v₁"".",0.00 / 1,,(A) es constante.,1.00 / 1,,(B) una fuerza hacia abajo debida a la gravedad y una fuerza horizontal en la dirección del movimiento.,0.00 / 1,,(C),0.00 / 1,,(C) una fuerza hacia abajo prácticamente constante debida a la gravedad junto con una fuerza hacia arriba que disminuye continuamente hasta que la bola alcanza su punto más alto; en el camino de descenso sólo hay una fuerza constante hacia abajo debida a la gravedad.,0.00 / 1,,(D),1.00 / 1,,(A) la intensidad de la fuerza que el automóvil aplica sobre el camión es igual a la de la fuerza que el camión aplica sobre el auto.,1.00 / 1,,(C) la intensidad de la fuerza que el automóvil aplica sobre el camión es mayor que la de la fuerza que el camión aplica sobre el auto.,0.00 / 1,,(A) la fuerza hacia arriba ejercida por el cable es mayor que la fuerza hacia abajo debida a la gravedad.,0.00 / 1,,(C) 1 y 3.,0.00 / 1,,"(E) sí, en algún momento durante el intervalo de 3 a 4.",1.00 / 1,,"(A) la aceleración de ""a"" es mayor que la aceleración de ""b"".",0.00 / 1,,(C),0.00 / 1,,(A) constante.,0.00 / 1,,(B),1.00 / 1,,(A) constante.,1.00 / 1,,(E) es mayor que el peso de la caja y también que la fuerza total que se opone a su movimiento.,0.00 / 1,,"(A) con una velocidad constante que es el doble de la velocidad ""v₀"" de la pregunta anterior.",0.00 / 1,,(C) comenzará inmediatamente a frenar hasta pararse.,1.00 / 1,,"(D) ambos estudiantes ejercen una fuerza sobre el otro, pero ""a"" ejerce una fuerza mayor.",0.00 / 1,,"(D) 1, 2 y 3.",0.00 / 1,,"(E) 1, 2 y 3.",0.00 / 1,
2023/08/17 12:36:05 p. m. GMT-6,isaac.paez6318@alumnos.udg.mx,8.00 / 30,Isaac Paez Sanchez,-- / 0,,1,-- / 0,,No.,-- / 0,,E,-- / 0,,2023-08-17,-- / 0,,(C) aproximadamente el mismo para ambas bolas.,1.00 / 1,,(A) ambas bolas golpean el suelo aproximadamente a la misma distancia horizontal de la base de la mesa.,1.00 / 1,,(A) alcanza un máximo de velocidad muy pronto después de ser soltada y desde entonces cae con una velocidad constante.,0.00 / 1,,(A) la intensidad de la fuerza que el camión ejerce sobre el automóvil es mayor que la de la fuerza que el auto ejerce sobre el camión.,0.00 / 1,,(C) 1 y 3.,0.00 / 1,,(B),1.00 / 1,,(B),1.00 / 1,,(A),0.00 / 1,,"(B)  igual a la velocidad ""v₁"" resultante del golpe e independiente de la velocidad ""v₀"".",0.00 / 1,,(D) aumenta durante un rato y después disminuye.,0.00 / 1,,(B) una fuerza hacia abajo debida a la gravedad y una fuerza horizontal en la dirección del movimiento.,0.00 / 1,,(B),1.00 / 1,,(C) una fuerza hacia abajo prácticamente constante debida a la gravedad junto con una fuerza hacia arriba que disminuye continuamente hasta que la bola alcanza su punto más alto; en el camino de descenso sólo hay una fuerza constante hacia abajo debida a la gravedad.,0.00 / 1,,(C),0.00 / 1,,"(D) dado que el motor del automóvil está en marcha, éste puede empujar al camión, pero el motor del camión no está funcionando, de modo que el camión no puede empujar al auto. El camión es empujado hacia adelante simplemente porque está en el camino del automóvil.",0.00 / 1,,"(D) dado que el motor del automóvil está en marcha, éste puede empujar al camión, pero el motor del camión no está funcionando, de modo que el camión no puede empujar al auto. El camión es empujado hacia adelante simplemente porque está en el camino del automóvil.",0.00 / 1,,(A) la fuerza hacia arriba ejercida por el cable es mayor que la fuerza hacia abajo debida a la gravedad.,0.00 / 1,,(C) 1 y 3.,0.00 / 1,,"(C) sí, en el instante 5.",0.00 / 1,,"(C) la aceleración de ""b"" es mayor que la aceleración de ""a"".",0.00 / 1,,(D),0.00 / 1,,(D) creciente durante un rato y después constante.,0.00 / 1,,(B),1.00 / 1,,(A) constante.,1.00 / 1,,(B) es mayor que el peso de la caja.,0.00 / 1,,"(A) con una velocidad constante que es el doble de la velocidad ""v₀"" de la pregunta anterior.",0.00 / 1,,(C) comenzará inmediatamente a frenar hasta pararse.,1.00 / 1,,"(B) el estudiante ""a"" ejerce una fuerza sobre el estudiante ""b"", pero ""b"" no ejerce ninguna fuerza sobre ""a"".",0.00 / 1,,(E) ninguna de las fuerzas. (Puesto que la silla está en reposo no hay ninguna fuerza actuando sobre ella).,0.00 / 1,,"(E) 1, 2 y 3.",0.00 / 1,
2023/08/17 1:15:34 p. m. GMT-6,iris.pacheco6414@alumnos.udg.mx,26.00 / 30,Pacheco Dávila Iris Del Rosario ,-- / 0,,Segundo,-- / 0,,No.,-- / 0,,E,-- / 0,,2023-08-17,-- / 0,,(C) aproximadamente el mismo para ambas bolas.,1.00 / 1,,(A) ambas bolas golpean el suelo aproximadamente a la misma distancia horizontal de la base de la mesa.,1.00 / 1,,(C) aumenta su velocidad porque una fuerza de gravedad casi constante actúa sobre ella.,1.00 / 1,,(E) el camión ejerce una fuerza de la misma intensidad sobre el auto que la que el auto ejerce sobre el camión.,1.00 / 1,,(B) 1 y 2.,1.00 / 1,,(A),0.00 / 1,,(A),0.00 / 1,,(B),1.00 / 1,,"(E) mayor que cualquiera de las velocidades ""v₀"" o ""v₁"", pero menor que la suma aritmética de estas dos velocidades.",1.00 / 1,,(A) es constante.,1.00 / 1,,(D) una fuerza hacia abajo debida a la gravedad y una fuerza hacia arriba ejercida por la superficie.,1.00 / 1,,(B),1.00 / 1,,"(D) sólo una fuerza hacia abajo, prácticamente constante, debida a la gravedad.",1.00 / 1,,(A),0.00 / 1,,(A) la intensidad de la fuerza que el automóvil aplica sobre el camión es igual a la de la fuerza que el camión aplica sobre el auto.,1.00 / 1,,(A) la intensidad de la fuerza que el automóvil aplica sobre el camión es igual a la de la fuerza que el camión aplica sobre el auto.,1.00 / 1,,(B) la fuerza hacia arriba ejercida por el cable es igual a la fuerza hacia abajo debida a la gravedad.,1.00 / 1,,(B) 1 y 2.,1.00 / 1,,"(E) sí, en algún momento durante el intervalo de 3 a 4.",1.00 / 1,,"(D) la aceleración de ""a"" es igual a la aceleración de ""b"". Ambas aceleraciones son cero.",1.00 / 1,,(B),0.00 / 1,,(B) continuamente creciente.,1.00 / 1,,(B),1.00 / 1,,(A) constante.,1.00 / 1,,(C) tiene la misma magnitud que la fuerza total que se opone al movimiento de la caja.,1.00 / 1,,(E) con una velocidad continuamente creciente.,1.00 / 1,,(C) comenzará inmediatamente a frenar hasta pararse.,1.00 / 1,,(E) ambos estudiantes ejercen la misma cantidad de fuerza sobre el otro.,1.00 / 1,,(B) 1 y 2.,1.00 / 1,,(C) 1 y 3.,1.00 / 1,
2023/08/17 1:22:15 p. m. GMT-6,quehat.fonseca9171@alumnos.udg.mx,19.00 / 30,Quehat Yair Fonseca Rocha,-- / 0,,1,-- / 0,,No.,-- / 0,,E,-- / 0,,2023-08-17,-- / 0,,(C) aproximadamente el mismo para ambas bolas.,1.00 / 1,,(A) ambas bolas golpean el suelo aproximadamente a la misma distancia horizontal de la base de la mesa.,1.00 / 1,,(C) aumenta su velocidad porque una fuerza de gravedad casi constante actúa sobre ella.,1.00 / 1,,(A) la intensidad de la fuerza que el camión ejerce sobre el automóvil es mayor que la de la fuerza que el auto ejerce sobre el camión.,0.00 / 1,,(B) 1 y 2.,1.00 / 1,,(B),1.00 / 1,,(B),1.00 / 1,,(E),0.00 / 1,,"(E) mayor que cualquiera de las velocidades ""v₀"" o ""v₁"", pero menor que la suma aritmética de estas dos velocidades.",1.00 / 1,,(A) es constante.,1.00 / 1,,(D) una fuerza hacia abajo debida a la gravedad y una fuerza hacia arriba ejercida por la superficie.,1.00 / 1,,(C),0.00 / 1,,(B) una fuerza hacia arriba que disminuye continuamente desde el momento en que la bola abandona la mano del chico hasta que alcanza su punto más alto; en el camino de descenso hay una fuerza hacia abajo debida a la gravedad que aumenta continuamente a medida que el objeto se acerca progresivamente a la tierra.,0.00 / 1,,(A),0.00 / 1,,(C) la intensidad de la fuerza que el automóvil aplica sobre el camión es mayor que la de la fuerza que el camión aplica sobre el auto.,0.00 / 1,,(A) la intensidad de la fuerza que el automóvil aplica sobre el camión es igual a la de la fuerza que el camión aplica sobre el auto.,1.00 / 1,,(B) la fuerza hacia arriba ejercida por el cable es igual a la fuerza hacia abajo debida a la gravedad.,1.00 / 1,,(C) 1 y 3.,0.00 / 1,,"(D) sí, en los instantes 2 y 5.",0.00 / 1,,(E) no se da suficiente información para contestar la pregunta.,0.00 / 1,,(A),0.00 / 1,,(B) continuamente creciente.,1.00 / 1,,(D),0.00 / 1,,(A) constante.,1.00 / 1,,(C) tiene la misma magnitud que la fuerza total que se opone al movimiento de la caja.,1.00 / 1,,(E) con una velocidad continuamente creciente.,1.00 / 1,,(C) comenzará inmediatamente a frenar hasta pararse.,1.00 / 1,,(E) ambos estudiantes ejercen la misma cantidad de fuerza sobre el otro.,1.00 / 1,,(B) 1 y 2.,1.00 / 1,,(C) 1 y 3.,1.00 / 1,
2023/08/17 2:35:03 p. m. GMT-6,jesus.lopez7933@alumnos.udg.mx,10.00 / 30,Jesús Neftalí López Delgado ,-- / 0,,1,-- / 0,,"Sí, primera vez.",-- / 0,,E,-- / 0,,2023-08-17,-- / 0,,(C) aproximadamente el mismo para ambas bolas.,1.00 / 1,,"(D) la bola más pesada golpea el suelo considerablemente más cerca de la base de la mesa que la bola más liviana, pero no necesariamente a la mitad de la distancia horizontal.",0.00 / 1,,(C) aumenta su velocidad porque una fuerza de gravedad casi constante actúa sobre ella.,1.00 / 1,,(A) la intensidad de la fuerza que el camión ejerce sobre el automóvil es mayor que la de la fuerza que el auto ejerce sobre el camión.,0.00 / 1,,"(D) 1, 2 y 3.",0.00 / 1,,(C),0.00 / 1,,(B),1.00 / 1,,(B),1.00 / 1,,"(E) mayor que cualquiera de las velocidades ""v₀"" o ""v₁"", pero menor que la suma aritmética de estas dos velocidades.",1.00 / 1,,(E) es constante durante un rato y después disminuye.,0.00 / 1,,(B) una fuerza hacia abajo debida a la gravedad y una fuerza horizontal en la dirección del movimiento.,0.00 / 1,,(C),0.00 / 1,,(C) una fuerza hacia abajo prácticamente constante debida a la gravedad junto con una fuerza hacia arriba que disminuye continuamente hasta que la bola alcanza su punto más alto; en el camino de descenso sólo hay una fuerza constante hacia abajo debida a la gravedad.,0.00 / 1,,(C),0.00 / 1,,(A) la intensidad de la fuerza que el automóvil aplica sobre el camión es igual a la de la fuerza que el camión aplica sobre el auto.,1.00 / 1,,(C) la intensidad de la fuerza que el automóvil aplica sobre el camión es mayor que la de la fuerza que el camión aplica sobre el auto.,0.00 / 1,,(A) la fuerza hacia arriba ejercida por el cable es mayor que la fuerza hacia abajo debida a la gravedad.,0.00 / 1,,"(D) 1, 2 y 3.",0.00 / 1,,"(E) sí, en algún momento durante el intervalo de 3 a 4.",1.00 / 1,,"(C) la aceleración de ""b"" es mayor que la aceleración de ""a"".",0.00 / 1,,(B),0.00 / 1,,(A) constante.,0.00 / 1,,(C),0.00 / 1,,(A) constante.,1.00 / 1,,(D) es mayor que la fuerza total que se opone al movimiento de la caja.,0.00 / 1,,"(B) con una velocidad constante que es mayor que la velocidad ""v₀"" de la pregunta anterior, pero no necesariamente el doble.",0.00 / 1,,(C) comenzará inmediatamente a frenar hasta pararse.,1.00 / 1,,"(D) ambos estudiantes ejercen una fuerza sobre el otro, pero ""a"" ejerce una fuerza mayor.",0.00 / 1,,(B) 1 y 2.,1.00 / 1,,"(E) 1, 2 y 3.",0.00 / 1,
