2023/08/15 7:22:25 p. m. GMT-6,louis.day9128@alumnos.udg.mc,13.00 / 30,Louis Matthew Day,-- / 0,,1,-- / 0,,No.,-- / 0,,E,-- / 0,,2023-08-15,-- / 0,,(C) aproximadamente el mismo para ambas bolas.,1.00 / 1,,(B) la bola más pesada golpea el suelo aproximadamente a la mitad de la distancia horizontal de la base de la mesa que la bola más liviana.,0.00 / 1,,(C) aumenta su velocidad porque una fuerza de gravedad casi constante actúa sobre ella.,1.00 / 1,,(A) la intensidad de la fuerza que el camión ejerce sobre el automóvil es mayor que la de la fuerza que el auto ejerce sobre el camión.,0.00 / 1,,"(D) 1, 2 y 3.",0.00 / 1,,(B),1.00 / 1,,(C),0.00 / 1,,(B),1.00 / 1,,"(E) mayor que cualquiera de las velocidades ""v₀"" o ""v₁"", pero menor que la suma aritmética de estas dos velocidades.",1.00 / 1,,(A) es constante.,1.00 / 1,,(A) una fuerza hacia abajo debida a la gravedad.,0.00 / 1,,(B),1.00 / 1,,(C) una fuerza hacia abajo prácticamente constante debida a la gravedad junto con una fuerza hacia arriba que disminuye continuamente hasta que la bola alcanza su punto más alto; en el camino de descenso sólo hay una fuerza constante hacia abajo debida a la gravedad.,0.00 / 1,,(C),0.00 / 1,,(C) la intensidad de la fuerza que el automóvil aplica sobre el camión es mayor que la de la fuerza que el camión aplica sobre el auto.,0.00 / 1,,(C) la intensidad de la fuerza que el automóvil aplica sobre el camión es mayor que la de la fuerza que el camión aplica sobre el auto.,0.00 / 1,,(A) la fuerza hacia arriba ejercida por el cable es mayor que la fuerza hacia abajo debida a la gravedad.,0.00 / 1,,"(E) 1, 3 y 4.",0.00 / 1,,"(E) sí, en algún momento durante el intervalo de 3 a 4.",1.00 / 1,,"(C) la aceleración de ""b"" es mayor que la aceleración de ""a"".",0.00 / 1,,(E),1.00 / 1,,(B) continuamente creciente.,1.00 / 1,,(B),1.00 / 1,,(A) constante.,1.00 / 1,,(E) es mayor que el peso de la caja y también que la fuerza total que se opone a su movimiento.,0.00 / 1,,"(B) con una velocidad constante que es mayor que la velocidad ""v₀"" de la pregunta anterior, pero no necesariamente el doble.",0.00 / 1,,(C) comenzará inmediatamente a frenar hasta pararse.,1.00 / 1,,"(D) ambos estudiantes ejercen una fuerza sobre el otro, pero ""a"" ejerce una fuerza mayor.",0.00 / 1,,"(D) 1, 2 y 3.",0.00 / 1,,"(E) 1, 2 y 3.",0.00 / 1,
2023/08/15 7:40:07 p. m. GMT-6,jaime.reyes8068@alumnos.udg.mx,15.00 / 30,Jaime Osuel Reyes Plancarte,-- / 0,,1,-- / 0,,No.,-- / 0,,E,-- / 0,,2023-08-15,-- / 0,,(C) aproximadamente el mismo para ambas bolas.,1.00 / 1,,(A) ambas bolas golpean el suelo aproximadamente a la misma distancia horizontal de la base de la mesa.,1.00 / 1,,(C) aumenta su velocidad porque una fuerza de gravedad casi constante actúa sobre ella.,1.00 / 1,,(E) el camión ejerce una fuerza de la misma intensidad sobre el auto que la que el auto ejerce sobre el camión.,1.00 / 1,,"(D) 1, 2 y 3.",0.00 / 1,,(B),1.00 / 1,,(A),0.00 / 1,,(B),1.00 / 1,,"(E) mayor que cualquiera de las velocidades ""v₀"" o ""v₁"", pero menor que la suma aritmética de estas dos velocidades.",1.00 / 1,,(A) es constante.,1.00 / 1,,(B) una fuerza hacia abajo debida a la gravedad y una fuerza horizontal en la dirección del movimiento.,0.00 / 1,,(C),0.00 / 1,,(C) una fuerza hacia abajo prácticamente constante debida a la gravedad junto con una fuerza hacia arriba que disminuye continuamente hasta que la bola alcanza su punto más alto; en el camino de descenso sólo hay una fuerza constante hacia abajo debida a la gravedad.,0.00 / 1,,(A),0.00 / 1,,(A) la intensidad de la fuerza que el automóvil aplica sobre el camión es igual a la de la fuerza que el camión aplica sobre el auto.,1.00 / 1,,(A) la intensidad de la fuerza que el automóvil aplica sobre el camión es igual a la de la fuerza que el camión aplica sobre el auto.,1.00 / 1,,(A) la fuerza hacia arriba ejercida por el cable es mayor que la fuerza hacia abajo debida a la gravedad.,0.00 / 1,,"(E) 1, 3 y 4.",0.00 / 1,,"(E) sí, en algún momento durante el intervalo de 3 a 4.",1.00 / 1,,"(D) la aceleración de ""a"" es igual a la aceleración de ""b"". Ambas aceleraciones son cero.",1.00 / 1,,(B),0.00 / 1,,(A) constante.,0.00 / 1,,(C),0.00 / 1,,(A) constante.,1.00 / 1,,(D) es mayor que la fuerza total que se opone al movimiento de la caja.,0.00 / 1,,"(A) con una velocidad constante que es el doble de la velocidad ""v₀"" de la pregunta anterior.",0.00 / 1,,(C) comenzará inmediatamente a frenar hasta pararse.,1.00 / 1,,"(D) ambos estudiantes ejercen una fuerza sobre el otro, pero ""a"" ejerce una fuerza mayor.",0.00 / 1,,(B) 1 y 2.,1.00 / 1,,"(E) 1, 2 y 3.",0.00 / 1,
2023/08/15 7:44:29 p. m. GMT-6,ricardo.barajas0234@alumnos.udg.mx,4.00 / 30,Ricardo Barajas Lomelí,-- / 0,,Primero,-- / 0,,No.,-- / 0,,E,-- / 0,,2023-08-15,-- / 0,,"(D) considerablemente menor para la bola más pesada, pero no necesariamente la mitad.",0.00 / 1,,"(D) la bola más pesada golpea el suelo considerablemente más cerca de la base de la mesa que la bola más liviana, pero no necesariamente a la mitad de la distancia horizontal.",0.00 / 1,,(B) aumenta su velocidad mientras cae porque la atracción gravitatoria se hace considerablemente mayor cuanto más se acerca la piedra a la tierra.,0.00 / 1,,(A) la intensidad de la fuerza que el camión ejerce sobre el automóvil es mayor que la de la fuerza que el auto ejerce sobre el camión.,0.00 / 1,,(C) 1 y 3.,0.00 / 1,,(E),0.00 / 1,,(D),0.00 / 1,,(A),0.00 / 1,,"(B)  igual a la velocidad ""v₁"" resultante del golpe e independiente de la velocidad ""v₀"".",0.00 / 1,,(D) aumenta durante un rato y después disminuye.,0.00 / 1,,(D) una fuerza hacia abajo debida a la gravedad y una fuerza hacia arriba ejercida por la superficie.,1.00 / 1,,(D),0.00 / 1,,(B) una fuerza hacia arriba que disminuye continuamente desde el momento en que la bola abandona la mano del chico hasta que alcanza su punto más alto; en el camino de descenso hay una fuerza hacia abajo debida a la gravedad que aumenta continuamente a medida que el objeto se acerca progresivamente a la tierra.,0.00 / 1,,(A),0.00 / 1,,(B) la intensidad de la fuerza que el automóvil aplica sobre el camión es menor que la de la fuerza que el camión aplica sobre el auto.,0.00 / 1,,(C) la intensidad de la fuerza que el automóvil aplica sobre el camión es mayor que la de la fuerza que el camión aplica sobre el auto.,0.00 / 1,,(A) la fuerza hacia arriba ejercida por el cable es mayor que la fuerza hacia abajo debida a la gravedad.,0.00 / 1,,"(D) 1, 2 y 3.",0.00 / 1,,(A) no.,0.00 / 1,,"(C) la aceleración de ""b"" es mayor que la aceleración de ""a"".",0.00 / 1,,(D),0.00 / 1,,(D) creciente durante un rato y después constante.,0.00 / 1,,(C),0.00 / 1,,(A) constante.,1.00 / 1,,(C) tiene la misma magnitud que la fuerza total que se opone al movimiento de la caja.,1.00 / 1,,"(A) con una velocidad constante que es el doble de la velocidad ""v₀"" de la pregunta anterior.",0.00 / 1,,(C) comenzará inmediatamente a frenar hasta pararse.,1.00 / 1,,"(C) ambos estudiantes ejercen una fuerza sobre el otro, pero ""b"" ejerce una fuerza mayor.",0.00 / 1,,(E) ninguna de las fuerzas. (Puesto que la silla está en reposo no hay ninguna fuerza actuando sobre ella).,0.00 / 1,,(B) 1 y 2.,0.00 / 1,
2023/08/15 7:49:38 p. m. GMT-6,daniel.corona3716@alumnos.udg.mx,12.00 / 30,Daniel Joel Corona Espinoza,-- / 0,,1ro,-- / 0,,No.,-- / 0,,E,-- / 0,,2023-08-15,-- / 0,,(C) aproximadamente el mismo para ambas bolas.,1.00 / 1,,(B) la bola más pesada golpea el suelo aproximadamente a la mitad de la distancia horizontal de la base de la mesa que la bola más liviana.,0.00 / 1,,"(E) cae debido a los efectos combinados de la fuerza de la gravedad, empujándola hacia abajo, y la fuerza del aire, también empujándola hacia abajo.",0.00 / 1,,(A) la intensidad de la fuerza que el camión ejerce sobre el automóvil es mayor que la de la fuerza que el auto ejerce sobre el camión.,0.00 / 1,,(B) 1 y 2.,1.00 / 1,,(B),1.00 / 1,,(B),1.00 / 1,,(B),1.00 / 1,,"(A) igual a la velocidad ""v₀"" que tenía antes de recibir el golpe.",0.00 / 1,,(A) es constante.,1.00 / 1,,(A) una fuerza hacia abajo debida a la gravedad.,0.00 / 1,,(B),1.00 / 1,,(B) una fuerza hacia arriba que disminuye continuamente desde el momento en que la bola abandona la mano del chico hasta que alcanza su punto más alto; en el camino de descenso hay una fuerza hacia abajo debida a la gravedad que aumenta continuamente a medida que el objeto se acerca progresivamente a la tierra.,0.00 / 1,,(B),0.00 / 1,,(B) la intensidad de la fuerza que el automóvil aplica sobre el camión es menor que la de la fuerza que el camión aplica sobre el auto.,0.00 / 1,,(A) la intensidad de la fuerza que el automóvil aplica sobre el camión es igual a la de la fuerza que el camión aplica sobre el auto.,1.00 / 1,,(A) la fuerza hacia arriba ejercida por el cable es mayor que la fuerza hacia abajo debida a la gravedad.,0.00 / 1,,(C) 1 y 3.,0.00 / 1,,"(D) sí, en los instantes 2 y 5.",0.00 / 1,,"(B) la aceleración de ""a"" es igual a la aceleración de ""b"". Ambas aceleraciones son mayores que cero.",0.00 / 1,,(C),0.00 / 1,,(B) continuamente creciente.,1.00 / 1,,(B),1.00 / 1,,(A) constante.,1.00 / 1,,(C) tiene la misma magnitud que la fuerza total que se opone al movimiento de la caja.,1.00 / 1,,"(D) con una velocidad creciente durante un rato, y después con una velocidad constante.",0.00 / 1,,(A) se parará inmediatamente.,0.00 / 1,,"(D) ambos estudiantes ejercen una fuerza sobre el otro, pero ""a"" ejerce una fuerza mayor.",0.00 / 1,,(A) sólo la 1.,0.00 / 1,,"(E) 1, 2 y 3.",0.00 / 1,
2023/08/15 7:54:21 p. m. GMT-6,andrea.estrella9202@alumnos.udg.mx,5.00 / 30,Andrea Louise Estrella San Luis ,-- / 0,,1,-- / 0,,No.,-- / 0,,E,-- / 0,,2023-08-15,-- / 0,,(A) aproximadamente la mitad para la bola más pesada que para la bola más liviana.,0.00 / 1,,(A) ambas bolas golpean el suelo aproximadamente a la misma distancia horizontal de la base de la mesa.,1.00 / 1,,(A) alcanza un máximo de velocidad muy pronto después de ser soltada y desde entonces cae con una velocidad constante.,0.00 / 1,,(A) la intensidad de la fuerza que el camión ejerce sobre el automóvil es mayor que la de la fuerza que el auto ejerce sobre el camión.,0.00 / 1,,(C) 1 y 3.,0.00 / 1,,(A),0.00 / 1,,(D),0.00 / 1,,(A),0.00 / 1,,"(B)  igual a la velocidad ""v₁"" resultante del golpe e independiente de la velocidad ""v₀"".",0.00 / 1,,(D) aumenta durante un rato y después disminuye.,0.00 / 1,,(B) una fuerza hacia abajo debida a la gravedad y una fuerza horizontal en la dirección del movimiento.,0.00 / 1,,(B),1.00 / 1,,(B) una fuerza hacia arriba que disminuye continuamente desde el momento en que la bola abandona la mano del chico hasta que alcanza su punto más alto; en el camino de descenso hay una fuerza hacia abajo debida a la gravedad que aumenta continuamente a medida que el objeto se acerca progresivamente a la tierra.,0.00 / 1,,(B),0.00 / 1,,(B) la intensidad de la fuerza que el automóvil aplica sobre el camión es menor que la de la fuerza que el camión aplica sobre el auto.,0.00 / 1,,(C) la intensidad de la fuerza que el automóvil aplica sobre el camión es mayor que la de la fuerza que el camión aplica sobre el auto.,0.00 / 1,,(A) la fuerza hacia arriba ejercida por el cable es mayor que la fuerza hacia abajo debida a la gravedad.,0.00 / 1,,(C) 1 y 3.,0.00 / 1,,"(D) sí, en los instantes 2 y 5.",0.00 / 1,,"(C) la aceleración de ""b"" es mayor que la aceleración de ""a"".",0.00 / 1,,(E),1.00 / 1,,(C) continuamente decreciente.,0.00 / 1,,(E),0.00 / 1,,(C) continuamente decreciente.,0.00 / 1,,(B) es mayor que el peso de la caja.,0.00 / 1,,"(A) con una velocidad constante que es el doble de la velocidad ""v₀"" de la pregunta anterior.",0.00 / 1,,(B) continuará moviéndose a una velocidad constante durante un rato y después frenará hasta pararse.,0.00 / 1,,(A) ninguno de los estudiantes ejerce una fuerza sobre el otro.,0.00 / 1,,(B) 1 y 2.,1.00 / 1,,(C) 1 y 3.,1.00 / 1,
2023/08/15 8:26:16 p. m. GMT-6,miguel.castillo9266@alumnos.udg.mx,10.00 / 30,Miguel Castillo Vazquez,-- / 0,,1ro,-- / 0,,No.,-- / 0,,E,-- / 0,,2023-08-15,-- / 0,,(C) aproximadamente el mismo para ambas bolas.,1.00 / 1,,(A) ambas bolas golpean el suelo aproximadamente a la misma distancia horizontal de la base de la mesa.,1.00 / 1,,(B) aumenta su velocidad mientras cae porque la atracción gravitatoria se hace considerablemente mayor cuanto más se acerca la piedra a la tierra.,0.00 / 1,,"(C) ninguno ejerce una fuerza sobre el otro, el auto es aplastado simplemente porque se interpone en el camino del camión.",0.00 / 1,,(C) 1 y 3.,0.00 / 1,,(B),1.00 / 1,,(B),1.00 / 1,,(E),0.00 / 1,,"(C) igual a la suma aritmética de las velocidades ""v₀"" y ""v₁"".",0.00 / 1,,(D) aumenta durante un rato y después disminuye.,0.00 / 1,,"(C) una fuerza hacia abajo debida a la gravedad, una fuerza hacia arriba ejercida por la superficie y una fuerza horizontal en la dirección del movimiento.",0.00 / 1,,(B),1.00 / 1,,(B) una fuerza hacia arriba que disminuye continuamente desde el momento en que la bola abandona la mano del chico hasta que alcanza su punto más alto; en el camino de descenso hay una fuerza hacia abajo debida a la gravedad que aumenta continuamente a medida que el objeto se acerca progresivamente a la tierra.,0.00 / 1,,(A),0.00 / 1,,(B) la intensidad de la fuerza que el automóvil aplica sobre el camión es menor que la de la fuerza que el camión aplica sobre el auto.,0.00 / 1,,(C) la intensidad de la fuerza que el automóvil aplica sobre el camión es mayor que la de la fuerza que el camión aplica sobre el auto.,0.00 / 1,,(D) la fuerza hacia arriba ejercida por el cable es mayor que la suma de la fuerza hacia abajo debida a la gravedad y una fuerza hacia abajo debida al aire.,0.00 / 1,,"(E) 1, 3 y 4.",0.00 / 1,,"(E) sí, en algún momento durante el intervalo de 3 a 4.",1.00 / 1,,"(C) la aceleración de ""b"" es mayor que la aceleración de ""a"".",0.00 / 1,,(E),1.00 / 1,,(D) creciente durante un rato y después constante.,0.00 / 1,,(E),0.00 / 1,,(A) constante.,1.00 / 1,,(C) tiene la misma magnitud que la fuerza total que se opone al movimiento de la caja.,1.00 / 1,,"(B) con una velocidad constante que es mayor que la velocidad ""v₀"" de la pregunta anterior, pero no necesariamente el doble.",0.00 / 1,,(C) comenzará inmediatamente a frenar hasta pararse.,1.00 / 1,,"(D) ambos estudiantes ejercen una fuerza sobre el otro, pero ""a"" ejerce una fuerza mayor.",0.00 / 1,,(A) sólo la 1.,0.00 / 1,,"(E) 1, 2 y 3.",0.00 / 1,
2023/08/15 9:00:47 p. m. GMT-6,laura.carbajal9912@alumnos.udg.mx,4.00 / 30,Laura Ixchel Carbajal Jimenez,-- / 0,,1,-- / 0,,No.,-- / 0,,E,-- / 0,,2023-08-15,-- / 0,,(A) aproximadamente la mitad para la bola más pesada que para la bola más liviana.,0.00 / 1,,"(D) la bola más pesada golpea el suelo considerablemente más cerca de la base de la mesa que la bola más liviana, pero no necesariamente a la mitad de la distancia horizontal.",0.00 / 1,,"(E) cae debido a los efectos combinados de la fuerza de la gravedad, empujándola hacia abajo, y la fuerza del aire, también empujándola hacia abajo.",0.00 / 1,,(A) la intensidad de la fuerza que el camión ejerce sobre el automóvil es mayor que la de la fuerza que el auto ejerce sobre el camión.,0.00 / 1,,(B) 1 y 2.,1.00 / 1,,(A),0.00 / 1,,(D),0.00 / 1,,(B),1.00 / 1,,"(B)  igual a la velocidad ""v₁"" resultante del golpe e independiente de la velocidad ""v₀"".",0.00 / 1,,(C) disminuye continuamente.,0.00 / 1,,(B) una fuerza hacia abajo debida a la gravedad y una fuerza horizontal en la dirección del movimiento.,0.00 / 1,,(C),0.00 / 1,,(C) una fuerza hacia abajo prácticamente constante debida a la gravedad junto con una fuerza hacia arriba que disminuye continuamente hasta que la bola alcanza su punto más alto; en el camino de descenso sólo hay una fuerza constante hacia abajo debida a la gravedad.,0.00 / 1,,(A),0.00 / 1,,(C) la intensidad de la fuerza que el automóvil aplica sobre el camión es mayor que la de la fuerza que el camión aplica sobre el auto.,0.00 / 1,,(C) la intensidad de la fuerza que el automóvil aplica sobre el camión es mayor que la de la fuerza que el camión aplica sobre el auto.,0.00 / 1,,(D) la fuerza hacia arriba ejercida por el cable es mayor que la suma de la fuerza hacia abajo debida a la gravedad y una fuerza hacia abajo debida al aire.,0.00 / 1,,"(E) 1, 3 y 4.",0.00 / 1,,"(D) sí, en los instantes 2 y 5.",0.00 / 1,,"(C) la aceleración de ""b"" es mayor que la aceleración de ""a"".",0.00 / 1,,(C),0.00 / 1,,(B) continuamente creciente.,1.00 / 1,,(C),0.00 / 1,,(A) constante.,1.00 / 1,,(E) es mayor que el peso de la caja y también que la fuerza total que se opone a su movimiento.,0.00 / 1,,"(B) con una velocidad constante que es mayor que la velocidad ""v₀"" de la pregunta anterior, pero no necesariamente el doble.",0.00 / 1,,(B) continuará moviéndose a una velocidad constante durante un rato y después frenará hasta pararse.,0.00 / 1,,"(D) ambos estudiantes ejercen una fuerza sobre el otro, pero ""a"" ejerce una fuerza mayor.",0.00 / 1,,(A) sólo la 1.,0.00 / 1,,"(E) 1, 2 y 3.",0.00 / 1,
2023/08/15 9:11:34 p. m. GMT-6,humberto.pena9232@alumnos.udg.mx,11.00 / 30,Humberto de Jesús Peña Dueñas,-- / 0,,1,-- / 0,,No.,-- / 0,,E,-- / 0,,2005-02-06,-- / 0,,(C) aproximadamente el mismo para ambas bolas.,1.00 / 1,,"(D) la bola más pesada golpea el suelo considerablemente más cerca de la base de la mesa que la bola más liviana, pero no necesariamente a la mitad de la distancia horizontal.",0.00 / 1,,(A) alcanza un máximo de velocidad muy pronto después de ser soltada y desde entonces cae con una velocidad constante.,0.00 / 1,,(A) la intensidad de la fuerza que el camión ejerce sobre el automóvil es mayor que la de la fuerza que el auto ejerce sobre el camión.,0.00 / 1,,(C) 1 y 3.,0.00 / 1,,(A),0.00 / 1,,(B),1.00 / 1,,(E),0.00 / 1,,"(B)  igual a la velocidad ""v₁"" resultante del golpe e independiente de la velocidad ""v₀"".",0.00 / 1,,(A) es constante.,1.00 / 1,,(B) una fuerza hacia abajo debida a la gravedad y una fuerza horizontal en la dirección del movimiento.,0.00 / 1,,(B),1.00 / 1,,(B) una fuerza hacia arriba que disminuye continuamente desde el momento en que la bola abandona la mano del chico hasta que alcanza su punto más alto; en el camino de descenso hay una fuerza hacia abajo debida a la gravedad que aumenta continuamente a medida que el objeto se acerca progresivamente a la tierra.,0.00 / 1,,(D),1.00 / 1,,"(D) dado que el motor del automóvil está en marcha, éste puede empujar al camión, pero el motor del camión no está funcionando, de modo que el camión no puede empujar al auto. El camión es empujado hacia adelante simplemente porque está en el camino del automóvil.",0.00 / 1,,(A) la intensidad de la fuerza que el automóvil aplica sobre el camión es igual a la de la fuerza que el camión aplica sobre el auto.,1.00 / 1,,(D) la fuerza hacia arriba ejercida por el cable es mayor que la suma de la fuerza hacia abajo debida a la gravedad y una fuerza hacia abajo debida al aire.,0.00 / 1,,"(E) 1, 3 y 4.",0.00 / 1,,"(E) sí, en algún momento durante el intervalo de 3 a 4.",1.00 / 1,,"(C) la aceleración de ""b"" es mayor que la aceleración de ""a"".",0.00 / 1,,(E),1.00 / 1,,(B) continuamente creciente.,1.00 / 1,,(B),1.00 / 1,,(A) constante.,1.00 / 1,,(A) tiene la misma magnitud que el peso de la caja.,0.00 / 1,,"(A) con una velocidad constante que es el doble de la velocidad ""v₀"" de la pregunta anterior.",0.00 / 1,,(A) se parará inmediatamente.,0.00 / 1,,"(D) ambos estudiantes ejercen una fuerza sobre el otro, pero ""a"" ejerce una fuerza mayor.",0.00 / 1,,(A) sólo la 1.,0.00 / 1,,"(E) 1, 2 y 3.",0.00 / 1,
2023/08/15 10:02:29 p. m. GMT-6,diego.plazola0323@alumnos.udg.mx,10.00 / 30,Diego Alberto Plazola González,-- / 0,,1er semestre,-- / 0,,No.,-- / 0,,E,-- / 0,,2001-10-11,-- / 0,,(A) aproximadamente la mitad para la bola más pesada que para la bola más liviana.,0.00 / 1,,"(D) la bola más pesada golpea el suelo considerablemente más cerca de la base de la mesa que la bola más liviana, pero no necesariamente a la mitad de la distancia horizontal.",0.00 / 1,,(B) aumenta su velocidad mientras cae porque la atracción gravitatoria se hace considerablemente mayor cuanto más se acerca la piedra a la tierra.,0.00 / 1,,(A) la intensidad de la fuerza que el camión ejerce sobre el automóvil es mayor que la de la fuerza que el auto ejerce sobre el camión.,0.00 / 1,,(C) 1 y 3.,0.00 / 1,,(B),1.00 / 1,,(B),1.00 / 1,,(A),0.00 / 1,,"(B)  igual a la velocidad ""v₁"" resultante del golpe e independiente de la velocidad ""v₀"".",0.00 / 1,,(A) es constante.,1.00 / 1,,(B) una fuerza hacia abajo debida a la gravedad y una fuerza horizontal en la dirección del movimiento.,0.00 / 1,,(B),1.00 / 1,,(C) una fuerza hacia abajo prácticamente constante debida a la gravedad junto con una fuerza hacia arriba que disminuye continuamente hasta que la bola alcanza su punto más alto; en el camino de descenso sólo hay una fuerza constante hacia abajo debida a la gravedad.,0.00 / 1,,(A),0.00 / 1,,(C) la intensidad de la fuerza que el automóvil aplica sobre el camión es mayor que la de la fuerza que el camión aplica sobre el auto.,0.00 / 1,,(C) la intensidad de la fuerza que el automóvil aplica sobre el camión es mayor que la de la fuerza que el camión aplica sobre el auto.,0.00 / 1,,(A) la fuerza hacia arriba ejercida por el cable es mayor que la fuerza hacia abajo debida a la gravedad.,0.00 / 1,,"(E) 1, 3 y 4.",0.00 / 1,,"(D) sí, en los instantes 2 y 5.",0.00 / 1,,"(C) la aceleración de ""b"" es mayor que la aceleración de ""a"".",0.00 / 1,,(C),0.00 / 1,,(B) continuamente creciente.,1.00 / 1,,(B),1.00 / 1,,(A) constante.,1.00 / 1,,(B) es mayor que el peso de la caja.,0.00 / 1,,(E) con una velocidad continuamente creciente.,1.00 / 1,,(C) comenzará inmediatamente a frenar hasta pararse.,1.00 / 1,,"(D) ambos estudiantes ejercen una fuerza sobre el otro, pero ""a"" ejerce una fuerza mayor.",0.00 / 1,,(A) sólo la 1.,0.00 / 1,,(C) 1 y 3.,1.00 / 1,
2023/08/15 10:05:27 p. m. GMT-6,cesar.amezcua3021@alumnos.udg.mx,9.00 / 30,César David Amezcua Naranjo,-- / 0,,1ero,-- / 0,,No.,-- / 0,,E,-- / 0,,2023-08-15,-- / 0,,(C) aproximadamente el mismo para ambas bolas.,1.00 / 1,,(A) ambas bolas golpean el suelo aproximadamente a la misma distancia horizontal de la base de la mesa.,1.00 / 1,,(A) alcanza un máximo de velocidad muy pronto después de ser soltada y desde entonces cae con una velocidad constante.,0.00 / 1,,(D) el camión ejerce una fuerza sobre el automóvil pero el auto no ejerce ninguna fuerza sobre el camión.,0.00 / 1,,"(E) 1, 3 y 4.",0.00 / 1,,(B),1.00 / 1,,(B),1.00 / 1,,(B),1.00 / 1,,"(C) igual a la suma aritmética de las velocidades ""v₀"" y ""v₁"".",0.00 / 1,,(A) es constante.,1.00 / 1,,"(C) una fuerza hacia abajo debida a la gravedad, una fuerza hacia arriba ejercida por la superficie y una fuerza horizontal en la dirección del movimiento.",0.00 / 1,,(B),1.00 / 1,,(B) una fuerza hacia arriba que disminuye continuamente desde el momento en que la bola abandona la mano del chico hasta que alcanza su punto más alto; en el camino de descenso hay una fuerza hacia abajo debida a la gravedad que aumenta continuamente a medida que el objeto se acerca progresivamente a la tierra.,0.00 / 1,,(D),1.00 / 1,,(C) la intensidad de la fuerza que el automóvil aplica sobre el camión es mayor que la de la fuerza que el camión aplica sobre el auto.,0.00 / 1,,(C) la intensidad de la fuerza que el automóvil aplica sobre el camión es mayor que la de la fuerza que el camión aplica sobre el auto.,0.00 / 1,,(A) la fuerza hacia arriba ejercida por el cable es mayor que la fuerza hacia abajo debida a la gravedad.,0.00 / 1,,"(D) 1, 2 y 3.",0.00 / 1,,"(D) sí, en los instantes 2 y 5.",0.00 / 1,,"(C) la aceleración de ""b"" es mayor que la aceleración de ""a"".",0.00 / 1,,(C),0.00 / 1,,(A) constante.,0.00 / 1,,(A),0.00 / 1,,(A) constante.,1.00 / 1,,(E) es mayor que el peso de la caja y también que la fuerza total que se opone a su movimiento.,0.00 / 1,,"(A) con una velocidad constante que es el doble de la velocidad ""v₀"" de la pregunta anterior.",0.00 / 1,,(A) se parará inmediatamente.,0.00 / 1,,"(D) ambos estudiantes ejercen una fuerza sobre el otro, pero ""a"" ejerce una fuerza mayor.",0.00 / 1,,(A) sólo la 1.,0.00 / 1,,"(E) 1, 2 y 3.",0.00 / 1,
