Marca temporal,Nombre de usuario,Puntuación total,Nombre completo:,Nombre completo: [Puntuación],Nombre completo: [Comentarios],Semestre:,Semestre: [Puntuación],Semestre: [Comentarios],¿Repite la materia?,¿Repite la materia? [Puntuación],¿Repite la materia? [Comentarios],Grupo:,Grupo: [Puntuación],Grupo: [Comentarios],Fecha:,Fecha: [Puntuación],Fecha: [Comentarios],"1. Dos bolas de metal tienen el mismo tamaño, pero una pesa el doble que la otra. Se dejan caer estas bolas desde el techo de un edificio de un solo piso en el mismo instante de tiempo. El tiempo que tardan las bolas en llegar al suelo es",1,"1. Dos bolas de metal tienen el mismo tamaño, pero una pesa el doble que la otra. Se dejan caer estas bolas desde el techo de un edificio de un solo piso en el mismo instante de tiempo. El tiempo que tardan las bolas en llegar al suelo es [Comentarios]",2. Las dos bolas de metal del problema anterior ruedan sobre una mesa horizontal con la misma velocidad y caen al suelo al llegar al borde de la mesa. En esta situación:,2,2. Las dos bolas de metal del problema anterior ruedan sobre una mesa horizontal con la misma velocidad y caen al suelo al llegar al borde de la mesa. En esta situación: [Comentarios],3. Una piedra que se deja caer desde el techo de un edificio de un solo piso hasta la superficie de la tierra:,3,3. Una piedra que se deja caer desde el techo de un edificio de un solo piso hasta la superficie de la tierra: [Comentarios],4.  Un camión grande choca frontalmente con un pequeño automóvil. Durante la colisión:,4,4.  Un camión grande choca frontalmente con un pequeño automóvil. Durante la colisión: [Comentarios],"5. Considérense las 4 diferentes fuerzas siguientes: (1) Una fuerza hacia abajo debida a la gravedad. (2) Una fuerza ejercida por el canal y dirigida de q hacia O. (3) Una fuerza en la dirección del movimiento. (4) Una fuerza en la dirección de O hacia q.      ¿Cuál(es) de dichas fuerzas actúa(n) sobre la bola cuando ésta se halla dentro del canal sin fricción en la posición ""q""?",5,"5. Considérense las 4 diferentes fuerzas siguientes: (1) Una fuerza hacia abajo debida a la gravedad. (2) Una fuerza ejercida por el canal y dirigida de q hacia O. (3) Una fuerza en la dirección del movimiento. (4) Una fuerza en la dirección de O hacia q.      ¿Cuál(es) de dichas fuerzas actúa(n) sobre la bola cuando ésta se halla dentro del canal sin fricción en la posición ""q""? [Comentarios]","6. ¿Cuál de los caminos indicados en la figura de la derecha seguirá de forma más aproximada la bola después de salir del canal por ""r"" si continúa moviéndose sin rozamiento sobre la superficie de la mesa?",6,"6. ¿Cuál de los caminos indicados en la figura de la derecha seguirá de forma más aproximada la bola después de salir del canal por ""r"" si continúa moviéndose sin rozamiento sobre la superficie de la mesa? [Comentarios]","7. Una bola de acero está atada a una cuerda y sigue una trayectoria circular en un plano horizontal como se muestra en la figura adjunta. En el punto P indicado en la figura, la cuerda se rompe de repente en un punto muy cercano a la bola. Si estos hechos se observan directamente desde arriba, como se indica en la figura, ¿qué camino seguirá de forma más aproximada la bola tras la ruptura de la cuerda?",7,"7. Una bola de acero está atada a una cuerda y sigue una trayectoria circular en un plano horizontal como se muestra en la figura adjunta. En el punto P indicado en la figura, la cuerda se rompe de repente en un punto muy cercano a la bola. Si estos hechos se observan directamente desde arriba, como se indica en la figura, ¿qué camino seguirá de forma más aproximada la bola tras la ruptura de la cuerda? [Comentarios]",8. ¿Cuál de los caminos siguientes seguirá de forma más aproximada el disco después de recibir el golpe?,8,8. ¿Cuál de los caminos siguientes seguirá de forma más aproximada el disco después de recibir el golpe? [Comentarios],9.  La velocidad del disco inmediatamente después de recibir el golpe es:,9,9.  La velocidad del disco inmediatamente después de recibir el golpe es: [Comentarios],"10.  A lo largo del camino sin fricción que usted ha elegido en la pregunta 8, la velocidad del disco después de recibir el golpe:",10,"10.  A lo largo del camino sin fricción que usted ha elegido en la pregunta 8, la velocidad del disco después de recibir el golpe: [Comentarios]","11. A lo largo del camino sin fricción que usted ha elegido en la pregunta 8, la(s) principal(es) fuerza(s) que actúa(n) sobre el disco después de recibir el golpe es (son):",11,"11. A lo largo del camino sin fricción que usted ha elegido en la pregunta 8, la(s) principal(es) fuerza(s) que actúa(n) sobre el disco después de recibir el golpe es (son): [Comentarios]",12. Con un cañón se dispara una bola desde el filo de un barranco como se muestra en la figura adjunta. ¿Cuál de los caminos seguirá de forma más aproximada dicha bola?,12,12. Con un cañón se dispara una bola desde el filo de un barranco como se muestra en la figura adjunta. ¿Cuál de los caminos seguirá de forma más aproximada dicha bola? [Comentarios],"13. Un chico lanza hacia arriba una bola de acero. Considere el movimiento de la bola durante el intervalo comprendido entre el momento en que ésta deja de estar en contacto con la mano del chico hasta un instante anterior al impacto con el suelo. Suponga que las fuerzas ejercidas por el aire son despreciables. En estas condiciones, la(s) fuerza(s) que actúa(n) sobre la bola es (son):",13,"13. Un chico lanza hacia arriba una bola de acero. Considere el movimiento de la bola durante el intervalo comprendido entre el momento en que ésta deja de estar en contacto con la mano del chico hasta un instante anterior al impacto con el suelo. Suponga que las fuerzas ejercidas por el aire son despreciables. En estas condiciones, la(s) fuerza(s) que actúa(n) sobre la bola es (son): [Comentarios]","14. Una bola se escapa accidentalmente de la bodega de carga de un avión que vuela en una dirección horizontal. Tal como lo observaría una persona de pie sobre el suelo que ve el avión como se muestra en la figura de la derecha, ¿qué camino seguiría de forma más aproximada dicha bola tras caer del avión?",14,"14. Una bola se escapa accidentalmente de la bodega de carga de un avión que vuela en una dirección horizontal. Tal como lo observaría una persona de pie sobre el suelo que ve el avión como se muestra en la figura de la derecha, ¿qué camino seguiría de forma más aproximada dicha bola tras caer del avión? [Comentarios]",15. Mientras el automóvil que empuja al camión acelera para alcanzar la velocidad de marcha:,15,15. Mientras el automóvil que empuja al camión acelera para alcanzar la velocidad de marcha: [Comentarios],16. Después de que el automóvil alcanza la velocidad constante de marcha a la que el conductor quiere empujar el camión:,16,16. Después de que el automóvil alcanza la velocidad constante de marcha a la que el conductor quiere empujar el camión: [Comentarios],"17. Un ascensor sube por su hueco a velocidad constante por medio de un cable de acero tal como se muestra en la figura adjunta. Todos los efectos debidos a la fricción son despreciables. En esta situación, las fuerzas que actúan sobre el ascensor son tales que:",17,"17. Un ascensor sube por su hueco a velocidad constante por medio de un cable de acero tal como se muestra en la figura adjunta. Todos los efectos debidos a la fricción son despreciables. En esta situación, las fuerzas que actúan sobre el ascensor son tales que: [Comentarios]","18. La figura adjunta muestra a un chico columpiándose en una cuerda, comenzando en un punto más alto que A. Considérense las siguientes fuerzas: (1) Una fuerza hacia abajo debida a la gravedad. (2) Una fuerza ejercida por la cuerda dirigida de A hacia O. (3) Una fuerza en la dirección del movimiento del chico. (4) Una fuerza en la dirección de O hacia A. ¿Cuál(es) de dichas fuerzas actúa(n) sobre el chico en la posición A?",18,"18. La figura adjunta muestra a un chico columpiándose en una cuerda, comenzando en un punto más alto que A. Considérense las siguientes fuerzas: (1) Una fuerza hacia abajo debida a la gravedad. (2) Una fuerza ejercida por la cuerda dirigida de A hacia O. (3) Una fuerza en la dirección del movimiento del chico. (4) Una fuerza en la dirección de O hacia A. ¿Cuál(es) de dichas fuerzas actúa(n) sobre el chico en la posición A? [Comentarios]",19. Las posiciones de dos bloques en intervalos de tiempo sucesivos de 0.20 segundos se hallan representadas por los cuadrados numerados de la figura adjunta. Los bloques se mueven hacia la derecha. ¿Tienen los bloques en algún momento la misma velocidad?,19,19. Las posiciones de dos bloques en intervalos de tiempo sucesivos de 0.20 segundos se hallan representadas por los cuadrados numerados de la figura adjunta. Los bloques se mueven hacia la derecha. ¿Tienen los bloques en algún momento la misma velocidad? [Comentarios],20. Las posiciones de dos bloques en intervalos sucesivos de 0.20 segundos se hallan representadas por los cuadrados numerados de la figura adjunta. Los bloques se mueven hacia la derecha. Las aceleraciones de los bloques están relacionadas de la forma siguiente:,20,20. Las posiciones de dos bloques en intervalos sucesivos de 0.20 segundos se hallan representadas por los cuadrados numerados de la figura adjunta. Los bloques se mueven hacia la derecha. Las aceleraciones de los bloques están relacionadas de la forma siguiente: [Comentarios],"21.  ¿Cuál de los siguientes caminos representa mejor la trayectoria del cohete entre los puntos ""b"" y ""c""?",21,"21.  ¿Cuál de los siguientes caminos representa mejor la trayectoria del cohete entre los puntos ""b"" y ""c""? [Comentarios]","22. Mientras el cohete se mueve desde la posición ""b"" hasta la posición ""c"" la magnitud de su velocidad es:",22,"22. Mientras el cohete se mueve desde la posición ""b"" hasta la posición ""c"" la magnitud de su velocidad es: [Comentarios]","23. En el punto ""c"" el motor del cohete se para y el empuje se anula inmediatamente. ¿Cuál de los siguientes caminos seguirá el cohete después del punto ""c""?",23,"23. En el punto ""c"" el motor del cohete se para y el empuje se anula inmediatamente. ¿Cuál de los siguientes caminos seguirá el cohete después del punto ""c""? [Comentarios]","24. A partir de la posición ""c"" la velocidad del cohete es:",24,"24. A partir de la posición ""c"" la velocidad del cohete es: [Comentarios]","25. Una mujer ejerce una fuerza horizontal constante sobre una caja grande. Como resultado, la caja se mueve sobre un piso horizontal a velocidad constante ""v₀"". La fuerza horizontal constante aplicada por la mujer:",25,"25. Una mujer ejerce una fuerza horizontal constante sobre una caja grande. Como resultado, la caja se mueve sobre un piso horizontal a velocidad constante ""v₀"". La fuerza horizontal constante aplicada por la mujer: [Comentarios]","26. Si la mujer de la pregunta anterior duplica la fuerza horizontal constante que ejerce sobre la caja para empujarla sobre el mismo piso horizontal, la caja se moverá:",26,"26. Si la mujer de la pregunta anterior duplica la fuerza horizontal constante que ejerce sobre la caja para empujarla sobre el mismo piso horizontal, la caja se moverá: [Comentarios]","27. Si la mujer de la pregunta 25 deja de aplicar de repente la fuerza horizontal sobre la caja, ésta:",27,"27. Si la mujer de la pregunta 25 deja de aplicar de repente la fuerza horizontal sobre la caja, ésta: [Comentarios]","28. En la figura adjunta, el estudiante ""a"" tiene una masa de 95 Kg y el estudiante ""b"" tiene una masa de 77 Kg. Ambos se sientan en idénticas sillas de oficina cara a cara. El estudiante ""a"" coloca sus pies descalzos sobre las rodillas del estudiante ""b"", tal como se muestra. Seguidamente el estudiante ""a"" empuja súbitamente con sus pies hacia adelante, haciendo que ambas sillas se muevan. Durante el empuje, mientras los estudiantes están aún en contacto:",28,"28. En la figura adjunta, el estudiante ""a"" tiene una masa de 95 Kg y el estudiante ""b"" tiene una masa de 77 Kg. Ambos se sientan en idénticas sillas de oficina cara a cara. El estudiante ""a"" coloca sus pies descalzos sobre las rodillas del estudiante ""b"", tal como se muestra. Seguidamente el estudiante ""a"" empuja súbitamente con sus pies hacia adelante, haciendo que ambas sillas se muevan. Durante el empuje, mientras los estudiantes están aún en contacto: [Comentarios]",29. Una silla de oficina vacía está en reposo sobre el suelo. Considérense las siguientes fuerzas: (1) Una fuerza hacia abajo debida a la gravedad. (2) Una fuerza hacia arriba ejercida por el suelo. (3) Una fuerza neta hacia abajo ejercida por el aire. ¿Cuál(es) de estas fuerzas actúa(n) sobre la silla de oficina?,29,29. Una silla de oficina vacía está en reposo sobre el suelo. Considérense las siguientes fuerzas: (1) Una fuerza hacia abajo debida a la gravedad. (2) Una fuerza hacia arriba ejercida por el suelo. (3) Una fuerza neta hacia abajo ejercida por el aire. ¿Cuál(es) de estas fuerzas actúa(n) sobre la silla de oficina? [Comentarios],"30. A pesar de que hace un viento muy fuerte, una tenista consigue golpear una pelota de tenis con su raqueta de modo que la pelota pasa por encima de la red y cae sobre el campo de su oponente. Considérense las siguientes fuerzas: (1) Una fuerza hacia abajo debida a la gravedad. (2) Una fuerza por el ""golpe"". (3) Una fuerza ejercida por el aire. ¿Cuál(es) de estas fuerzas actúa(n) sobre la pelota después de que ésta deja de estar en contacto con la raqueta y antes de que toque el suelo?",30,"30. A pesar de que hace un viento muy fuerte, una tenista consigue golpear una pelota de tenis con su raqueta de modo que la pelota pasa por encima de la red y cae sobre el campo de su oponente. Considérense las siguientes fuerzas: (1) Una fuerza hacia abajo debida a la gravedad. (2) Una fuerza por el ""golpe"". (3) Una fuerza ejercida por el aire. ¿Cuál(es) de estas fuerzas actúa(n) sobre la pelota después de que ésta deja de estar en contacto con la raqueta y antes de que toque el suelo? [Comentarios]"
2023/08/15 5:55:10 p. m. GMT-6,cristopher.zepeda@alumnos.udg.mx,5.00 / 30,Cristopher Uriel Zepeda Martinez,-- / 0,,1er semestre,-- / 0,,No.,-- / 0,,E,-- / 0,,2023-08-15,-- / 0,,(C) aproximadamente el mismo para ambas bolas.,1.00 / 1,,(A) ambas bolas golpean el suelo aproximadamente a la misma distancia horizontal de la base de la mesa.,1.00 / 1,,(A) alcanza un máximo de velocidad muy pronto después de ser soltada y desde entonces cae con una velocidad constante.,0.00 / 1,,(A) la intensidad de la fuerza que el camión ejerce sobre el automóvil es mayor que la de la fuerza que el auto ejerce sobre el camión.,0.00 / 1,,"(D) 1, 2 y 3.",0.00 / 1,,(B),1.00 / 1,,(B),1.00 / 1,,(C),0.00 / 1,,"(C) igual a la suma aritmética de las velocidades ""v₀"" y ""v₁"".",0.00 / 1,,(E) es constante durante un rato y después disminuye.,0.00 / 1,,(B) una fuerza hacia abajo debida a la gravedad y una fuerza horizontal en la dirección del movimiento.,0.00 / 1,,(C),0.00 / 1,,(C) una fuerza hacia abajo prácticamente constante debida a la gravedad junto con una fuerza hacia arriba que disminuye continuamente hasta que la bola alcanza su punto más alto; en el camino de descenso sólo hay una fuerza constante hacia abajo debida a la gravedad.,0.00 / 1,,(A),0.00 / 1,,(C) la intensidad de la fuerza que el automóvil aplica sobre el camión es mayor que la de la fuerza que el camión aplica sobre el auto.,0.00 / 1,,(C) la intensidad de la fuerza que el automóvil aplica sobre el camión es mayor que la de la fuerza que el camión aplica sobre el auto.,0.00 / 1,,(A) la fuerza hacia arriba ejercida por el cable es mayor que la fuerza hacia abajo debida a la gravedad.,0.00 / 1,,"(E) 1, 3 y 4.",0.00 / 1,,"(D) sí, en los instantes 2 y 5.",0.00 / 1,,"(A) la aceleración de ""a"" es mayor que la aceleración de ""b"".",0.00 / 1,,(B),0.00 / 1,,(D) creciente durante un rato y después constante.,0.00 / 1,,(C),0.00 / 1,,(D) creciente durante un rato y después constante.,0.00 / 1,,(B) es mayor que el peso de la caja.,0.00 / 1,,"(A) con una velocidad constante que es el doble de la velocidad ""v₀"" de la pregunta anterior.",0.00 / 1,,(C) comenzará inmediatamente a frenar hasta pararse.,1.00 / 1,,"(D) ambos estudiantes ejercen una fuerza sobre el otro, pero ""a"" ejerce una fuerza mayor.",0.00 / 1,,(A) sólo la 1.,0.00 / 1,,"(E) 1, 2 y 3.",0.00 / 1,
2023/08/15 6:27:39 p. m. GMT-6,alexis.larios9229@alumnos.udg.mx,18.00 / 30,Alexis Fabián Larios Mariscal,-- / 0,,1,-- / 0,,No.,-- / 0,,E,-- / 0,,2023-08-15,-- / 0,,(C) aproximadamente el mismo para ambas bolas.,1.00 / 1,,"(D) la bola más pesada golpea el suelo considerablemente más cerca de la base de la mesa que la bola más liviana, pero no necesariamente a la mitad de la distancia horizontal.",0.00 / 1,,(C) aumenta su velocidad porque una fuerza de gravedad casi constante actúa sobre ella.,1.00 / 1,,(E) el camión ejerce una fuerza de la misma intensidad sobre el auto que la que el auto ejerce sobre el camión.,1.00 / 1,,(B) 1 y 2.,1.00 / 1,,(B),1.00 / 1,,(B),1.00 / 1,,(B),1.00 / 1,,"(E) mayor que cualquiera de las velocidades ""v₀"" o ""v₁"", pero menor que la suma aritmética de estas dos velocidades.",1.00 / 1,,(A) es constante.,1.00 / 1,,(B) una fuerza hacia abajo debida a la gravedad y una fuerza horizontal en la dirección del movimiento.,0.00 / 1,,(D),0.00 / 1,,(C) una fuerza hacia abajo prácticamente constante debida a la gravedad junto con una fuerza hacia arriba que disminuye continuamente hasta que la bola alcanza su punto más alto; en el camino de descenso sólo hay una fuerza constante hacia abajo debida a la gravedad.,0.00 / 1,,(A),0.00 / 1,,(C) la intensidad de la fuerza que el automóvil aplica sobre el camión es mayor que la de la fuerza que el camión aplica sobre el auto.,0.00 / 1,,(A) la intensidad de la fuerza que el automóvil aplica sobre el camión es igual a la de la fuerza que el camión aplica sobre el auto.,1.00 / 1,,(D) la fuerza hacia arriba ejercida por el cable es mayor que la suma de la fuerza hacia abajo debida a la gravedad y una fuerza hacia abajo debida al aire.,0.00 / 1,,"(D) 1, 2 y 3.",0.00 / 1,,"(E) sí, en algún momento durante el intervalo de 3 a 4.",1.00 / 1,,"(C) la aceleración de ""b"" es mayor que la aceleración de ""a"".",0.00 / 1,,(C),0.00 / 1,,(A) constante.,0.00 / 1,,(B),1.00 / 1,,(A) constante.,1.00 / 1,,(E) es mayor que el peso de la caja y también que la fuerza total que se opone a su movimiento.,0.00 / 1,,(E) con una velocidad continuamente creciente.,1.00 / 1,,(C) comenzará inmediatamente a frenar hasta pararse.,1.00 / 1,,(E) ambos estudiantes ejercen la misma cantidad de fuerza sobre el otro.,1.00 / 1,,(B) 1 y 2.,1.00 / 1,,(C) 1 y 3.,1.00 / 1,
2023/08/15 6:37:55 p. m. GMT-6,mm1741586@gmail.com,5.00 / 30,Martín Alonso Muñoz Garza ,-- / 0,,1,-- / 0,,No.,-- / 0,,E,-- / 0,,2023-08-15,-- / 0,,"(D) considerablemente menor para la bola más pesada, pero no necesariamente la mitad.",0.00 / 1,,"(E) la bola más liviana golpea el suelo considerablemente más cerca de la base de la mesa que la bola más pesada, pero no necesariamente a la mitad de la distancia horizontal.",0.00 / 1,,(B) aumenta su velocidad mientras cae porque la atracción gravitatoria se hace considerablemente mayor cuanto más se acerca la piedra a la tierra.,0.00 / 1,,(A) la intensidad de la fuerza que el camión ejerce sobre el automóvil es mayor que la de la fuerza que el auto ejerce sobre el camión.,0.00 / 1,,(A)  sólo la 1.,0.00 / 1,,(D),0.00 / 1,,(B),1.00 / 1,,(E),0.00 / 1,,"(C) igual a la suma aritmética de las velocidades ""v₀"" y ""v₁"".",0.00 / 1,,(D) aumenta durante un rato y después disminuye.,0.00 / 1,,(B) una fuerza hacia abajo debida a la gravedad y una fuerza horizontal en la dirección del movimiento.,0.00 / 1,,(C),0.00 / 1,,(B) una fuerza hacia arriba que disminuye continuamente desde el momento en que la bola abandona la mano del chico hasta que alcanza su punto más alto; en el camino de descenso hay una fuerza hacia abajo debida a la gravedad que aumenta continuamente a medida que el objeto se acerca progresivamente a la tierra.,0.00 / 1,,(A),0.00 / 1,,"(D) dado que el motor del automóvil está en marcha, éste puede empujar al camión, pero el motor del camión no está funcionando, de modo que el camión no puede empujar al auto. El camión es empujado hacia adelante simplemente porque está en el camino del automóvil.",0.00 / 1,,(A) la intensidad de la fuerza que el automóvil aplica sobre el camión es igual a la de la fuerza que el camión aplica sobre el auto.,1.00 / 1,,(A) la fuerza hacia arriba ejercida por el cable es mayor que la fuerza hacia abajo debida a la gravedad.,0.00 / 1,,"(D) 1, 2 y 3.",0.00 / 1,,"(D) sí, en los instantes 2 y 5.",0.00 / 1,,"(A) la aceleración de ""a"" es mayor que la aceleración de ""b"".",0.00 / 1,,(E),1.00 / 1,,(A) constante.,0.00 / 1,,(B),1.00 / 1,,(A) constante.,1.00 / 1,,(D) es mayor que la fuerza total que se opone al movimiento de la caja.,0.00 / 1,,"(A) con una velocidad constante que es el doble de la velocidad ""v₀"" de la pregunta anterior.",0.00 / 1,,(A) se parará inmediatamente.,0.00 / 1,,"(B) el estudiante ""a"" ejerce una fuerza sobre el estudiante ""b"", pero ""b"" no ejerce ninguna fuerza sobre ""a"".",0.00 / 1,,(E) ninguna de las fuerzas. (Puesto que la silla está en reposo no hay ninguna fuerza actuando sobre ella).,0.00 / 1,,(B) 1 y 2.,0.00 / 1,
2023/08/15 7:10:02 p. m. GMT-6,hugo.garcia3075@alumnos.udg.mx,10.00 / 30,Hugo Gabriel Garcia Saldivar,-- / 0,,Primero,-- / 0,,No.,-- / 0,,E,-- / 0,,2023-08-15,-- / 0,,(C) aproximadamente el mismo para ambas bolas.,1.00 / 1,,"(D) la bola más pesada golpea el suelo considerablemente más cerca de la base de la mesa que la bola más liviana, pero no necesariamente a la mitad de la distancia horizontal.",0.00 / 1,,(C) aumenta su velocidad porque una fuerza de gravedad casi constante actúa sobre ella.,1.00 / 1,,(A) la intensidad de la fuerza que el camión ejerce sobre el automóvil es mayor que la de la fuerza que el auto ejerce sobre el camión.,0.00 / 1,,(C) 1 y 3.,0.00 / 1,,(B),1.00 / 1,,(B),1.00 / 1,,(B),1.00 / 1,,"(C) igual a la suma aritmética de las velocidades ""v₀"" y ""v₁"".",0.00 / 1,,(E) es constante durante un rato y después disminuye.,0.00 / 1,,"(C) una fuerza hacia abajo debida a la gravedad, una fuerza hacia arriba ejercida por la superficie y una fuerza horizontal en la dirección del movimiento.",0.00 / 1,,(B),1.00 / 1,,(B) una fuerza hacia arriba que disminuye continuamente desde el momento en que la bola abandona la mano del chico hasta que alcanza su punto más alto; en el camino de descenso hay una fuerza hacia abajo debida a la gravedad que aumenta continuamente a medida que el objeto se acerca progresivamente a la tierra.,0.00 / 1,,(B),0.00 / 1,,(C) la intensidad de la fuerza que el automóvil aplica sobre el camión es mayor que la de la fuerza que el camión aplica sobre el auto.,0.00 / 1,,(A) la intensidad de la fuerza que el automóvil aplica sobre el camión es igual a la de la fuerza que el camión aplica sobre el auto.,1.00 / 1,,(A) la fuerza hacia arriba ejercida por el cable es mayor que la fuerza hacia abajo debida a la gravedad.,0.00 / 1,,"(E) 1, 3 y 4.",0.00 / 1,,"(D) sí, en los instantes 2 y 5.",0.00 / 1,,"(A) la aceleración de ""a"" es mayor que la aceleración de ""b"".",0.00 / 1,,(E),1.00 / 1,,(B) continuamente creciente.,1.00 / 1,,(B),1.00 / 1,,(C) continuamente decreciente.,0.00 / 1,,(E) es mayor que el peso de la caja y también que la fuerza total que se opone a su movimiento.,0.00 / 1,,"(A) con una velocidad constante que es el doble de la velocidad ""v₀"" de la pregunta anterior.",0.00 / 1,,(A) se parará inmediatamente.,0.00 / 1,,"(C) ambos estudiantes ejercen una fuerza sobre el otro, pero ""b"" ejerce una fuerza mayor.",0.00 / 1,,(A) sólo la 1.,0.00 / 1,,"(E) 1, 2 y 3.",0.00 / 1,
